{
  "title": "Hashima HP-84A",
  "subtitle": "Fully Automatic Heat-Transfer Press",
  "brand": "Hashima",
  "category": "Pressing Machine",
  "machineImage": "",
  "reportDownloadUrl": "",
  "publishedDate": "2026-07-22T00:00:00.000Z",
  "purposeAndApplication": {
    "purpose": "The Hashima HP-84A is a fully automatic heat-transfer / fusing press used in garment assembly for bonding interlining to outer fabric. Heated aluminum plates apply uniform temperature and pressure. Motor-driven — no air compressor required.",
    "applications": [
      "Shirt collar and cuff fusing",
      "Small-part garment fusing (plackets, pocket flaps)",
      "Interlining bonding for medium-weight woven garments",
      "Continuous fusing operations"
    ],
    "industry": "Garment manufacturing (shirts, blouses, light industrial)"
  },
  "overviewDescription": "Made by Hashima Co., Ltd. (Japan). The HP-84A is the predecessor to the current Hashima HP-84N family. Still in distribution via official channels (e.g., IIGM Bangalore) but no longer featured in Hashima's own current product page. Modern successor HP-84N has updated heater wattage and control panel.",
  "classificationTable": [
    {
      "field": "Machine Name",
      "value": "Fully Automatic Heat-Transfer Press"
    },
    {
      "field": "Brand / Manufacturer",
      "value": "Hashima Co., Ltd. (Japan)"
    },
    {
      "field": "Model Series",
      "value": "HP-84A (predecessor) → HP-84N (current generation)"
    },
    {
      "field": "Stitch Type",
      "value": "N/A (heat-press machine, no stitching)"
    },
    {
      "field": "Bed / Frame Type",
      "value": "Horizontal platen heat press"
    },
    {
      "field": "Needle Configuration",
      "value": "N/A"
    },
    {
      "field": "Drive / Lubrication",
      "value": "Motor-driven, no air compressor required"
    }
  ],
  "technicalSpecs": [
    {
      "parameter": "Max Pressure",
      "value": "1,000 kg (per Hashima/IIGM description)"
    },
    {
      "parameter": "Operation",
      "value": "Pneumatic or electric; modern variant requires no air compressor"
    },
    {
      "parameter": "Control",
      "value": "Dial control of pressure, temperature, time"
    }
  ],
  "resources": [
    {
      "resourceName": "IIGM Bangalore — Hashima-KM HP-84A / 54A Fusing Machines product page (Tier-2)",
      "description": "Indian distributor of Hashima — current HP-84A / HP-54A spec page with 1,000 kg max pressure",
      "url": "https://www.iigm.com/HP-84A-54A.HTML"
    },
    {
      "resourceName": "Hashima current-generation HP-54N/HP-84N product page (Tier-1)",
      "description": "Official Hashima current-generation product page (successor family)",
      "url": "https://www.hashima.co.jp/en/products/fully-automatic-heat-transfer-press-2"
    }
  ],
  "finalNotes": "Phase 1 PARTIAL PASS — HP-84A is the predecessor to the current Hashima HP-84N. Classified metadata (Hashima, Japan, fully automatic heat-transfer press, motor-driven) verified Tier-1. Max pressure (1,000 kg) verified via Tier-2 IIGM distributor. Heater wattage for the exact HP-84A sub-variant not published in current material; successor HP-84N is 1,820 W. The page renders the 'More Information Coming Soon' banner until Detailed Research fills working principles, sequence flow, parts list, maintenance, and additional resources."
}
