{
  "title": "Zoje ZJ3800-PLB-J-BD",
  "subtitle": "2-Needle Feed-Off-Arm Chainstitch Machine (Pneumatic Lift, Bottom Feed, Direct-Drive)",
  "brand": "ZOJE",
  "category": "Chain Stitch Machine",
  "machineImage": "",
  "reportDownloadUrl": "",
  "publishedDate": "2026-07-22T00:00:00.000Z",
  "purposeAndApplication": {
    "purpose": "The ZJ3800-PLB-J-BD is a 2-needle feed-off-arm chainstitch machine from Zoje's ZJ3800 series. The suffix breaks down as: -PLB = pneumatic lift + bottom feed, -J = standard Japanese market configuration, -BD = direct-drive (built-in AC servo motor). Used for attaching waistbands, hemming jeans, and tubular garment operations.",
    "applications": [
      "Waistband attaching on jeans and trousers",
      "Hemming tubular garments (sleeves, trouser legs)",
      "2-needle parallel chainstitch operations requiring extra feeding accuracy",
      "Production lines needing direct-drive energy savings"
    ],
    "industry": "Jeans manufacturing, trouser production, sportswear, work-wear assembly"
  },
  "overviewDescription": "Made by Zoje (Zhejiang, China). Part of the ZJ3800 chainstitch family — a 2-needle flat-bed chainstitch machine using TV×7 (or 149×7) needle system. The base ZJ3800 runs 4,500 rpm with 4 mm stitch length; the `-BD` direct-drive variant runs 5,000 rpm per zoje-america.",
  "classificationTable": [
    {
      "field": "Machine Name",
      "value": "2-Needle Feed-Off-Arm Chainstitch Machine"
    },
    {
      "field": "Brand / Manufacturer",
      "value": "ZOJE (Zhejiang Zoje Sewing Technology Co., Ltd., China)"
    },
    {
      "field": "Model Series",
      "value": "ZJ3800 (variants: base, -BD direct-drive, -PLB pneumatic lift + bottom feed, -J Japanese market config)"
    },
    {
      "field": "Stitch Type",
      "value": "Chainstitch (2-needle parallel)"
    },
    {
      "field": "Bed / Frame Type",
      "value": "Feed-off-arm"
    },
    {
      "field": "Needle Configuration",
      "value": "2-needle"
    },
    {
      "field": "Drive / Lubrication",
      "value": "Direct-drive AC servo motor, central lubrication"
    }
  ],
  "technicalSpecs": [
    {
      "parameter": "Max. Sewing Speed",
      "value": "5,000 s.p.m. (-BD direct-drive variant)"
    },
    {
      "parameter": "Max. Stitch Length",
      "value": "4 mm"
    },
    {
      "parameter": "Foot Lifting Height",
      "value": "up to 10 mm (with PLB pneumatic lift)"
    },
    {
      "parameter": "Needle System",
      "value": "TV×7 (149×7)"
    },
    {
      "parameter": "Number of Needles",
      "value": "2"
    },
    {
      "parameter": "Material",
      "value": "Light to medium"
    },
    {
      "parameter": "Feed System",
      "value": "Bottom feed, connecting-rod type"
    }
  ],
  "resources": [
    {
      "resourceName": "Zoje Europe — ZJ3800 feed-off-arm series (Tier-1)",
      "description": "Tier-1 European distributor page",
      "url": "http://www.zoje-europe.com/feed-of-arm-machines/cat/k-2002513"
    },
    {
      "resourceName": "Zoje America — ZJ3800 series (Tier-1)",
      "description": "Tier-1 manufacturer technical detail page",
      "url": "http://zoje-america.com/high-speed-chainstitch-sewing-machine-zj3800-series"
    },
    {
      "resourceName": "SupSew ZJ3800N Series parts list PDF (Tier-2)",
      "description": "Distributor-hosted parts manual",
      "url": "https://www.supsew.com/download/Zoje/Zoje%20ZJ3800N%20SERIES.pdf"
    }
  ],
  "finalNotes": "Phase 1 basic research complete with Tier-1 Zoje Europe + Zoje America + 2 Tier-2 dealers. Detailed Research remains unfilled — partial-data state; the page will display the 'More Information Coming Soon' banner until Detailed Research adds working principles, sequence flow, parts list, maintenance, and additional resources."
}
