{
  "title": "Golden Wheel CS-5100BT",
  "subtitle": "Single-Needle Lockstitch Flatbed with Automatic Under-Trimming, Backtacking, and Wiper",
  "brand": "Golden Wheel",
  "category": "Lockstitch Machine",
  "machineImage": "",
  "reportDownloadUrl": "",
  "publishedDate": "2026-07-22T00:00:00.000Z",
  "purposeAndApplication": {
    "purpose": "The Golden Wheel CS-5100BT is a single-needle lockstitch flatbed with automatic under-trimming, backtacking, and wiper — the 'BT' suffix denotes these three automatic thread-handling functions. Suited for medium-to-heavy material work in apparel production.",
    "applications": [
      "General straight-stitch seaming on shirts, trousers, light workwear",
      "Medium-to-heavy woven fabric assembly",
      "Operations requiring automatic thread trimming, backtacking, and wiping"
    ],
    "industry": "Garment manufacturing, shirts and trousers, light industrial assembly"
  },
  "overviewDescription": "Made by Golden Wheel / Chee Siang Industrial Co., Ltd. (Taiwan). Part of the broader CS-5100 family — sub-variants include CS-5100-5 (no trimmer), CS-5100-5N-2T / CS-5100-5N-BT / CS-5100H / CS-5100HL / etc. The `-BT` suffix maps to the 'N-BT' variant = with thread trimmer and backtack. Confirmed by Star International (India dealer) 2020 YouTube demo titled 'CS-5100BT...automatic undertrimming & backtacking & wiper'.",
  "classificationTable": [
    {
      "field": "Machine Name",
      "value": "Single-Needle Lockstitch Flatbed with Auto Under-Trimming + Backtack + Wiper"
    },
    {
      "field": "Brand / Manufacturer",
      "value": "Golden Wheel / Chee Siang Industrial Co., Ltd. (Taiwan)"
    },
    {
      "field": "Model Series",
      "value": "CS-5100 (sub-variants: CS-5100-5 base, N-BT trimmer+backtack, N-2T needle feed+trimmer, H heavy, HL heavy-long-arm)"
    },
    {
      "field": "Stitch Type",
      "value": "Lockstitch (single needle)"
    },
    {
      "field": "Bed / Frame Type",
      "value": "Flat bed"
    },
    {
      "field": "Needle Configuration",
      "value": "Single needle"
    },
    {
      "field": "Drive / Lubrication",
      "value": "Direct-drive servo, automatic lubrication"
    }
  ],
  "technicalSpecs": [
    {
      "parameter": "Max. Sewing Speed",
      "value": "4,000 spm"
    },
    {
      "parameter": "Max. Stitch Length",
      "value": "5 mm"
    },
    {
      "parameter": "Presser Foot Lift (hand / knee)",
      "value": "5.5 / 13 mm"
    },
    {
      "parameter": "Sewn Materials",
      "value": "Medium to Heavy"
    },
    {
      "parameter": "Auto Functions",
      "value": "Under-trim, backtack, wiper"
    }
  ],
  "resources": [
    {
      "resourceName": "Golden Wheel CS-5100 family page (Tier-1)",
      "description": "Tier-1 manufacturer family page with sub-variant table",
      "url": "https://www.golden-wheel.com/en/products/cs-5100-5-flat-bed-normal-bottom-feed"
    },
    {
      "resourceName": "Golden Wheel CS-5100-5 catalog PDF (Tier-1)",
      "description": "Official Golden Wheel catalog PDF",
      "url": "https://www.golden-wheel.com/wp-content/uploads/2025/01/CS-5100-5-en-Heavy-duty.pdf"
    },
    {
      "resourceName": "Star International YouTube demo (Tier-2)",
      "description": "Dealer YouTube demo titled specifically for CS-5100BT confirming automatic undertrimming, backtacking, and wiper",
      "url": "https://www.youtube.com/watch?v=KVbkpzTAZtA"
    }
  ],
  "finalNotes": "Phase 1 basic research complete with Tier-1 Golden Wheel family page. Detailed Research remains unfilled — partial-data state; the page will display the 'More Information Coming Soon' banner until Detailed Research adds working principles, sequence flow, parts list, maintenance, and additional resources."
}
