{
  "title": "Jocky JK-SQ1",
  "subtitle": "1-Puncher Pneumatic Snap-Attaching Machine with Protector Ring",
  "brand": "Jocky",
  "category": "Button Attaching Machine",
  "machineImage": "",
  "reportDownloadUrl": "",
  "publishedDate": "2026-07-22T00:00:00.000Z",
  "purposeAndApplication": {
    "purpose": "The Jocky JK-SQ1 is a 1-puncher pneumatic snap-button attaching machine with an integrated protector ring — the standard industrial workhorse for attaching snap buttons to garments using compressed air. Driven by air rather than electricity, allowing operation without electrical power as long as compressed-air pressure is maintained.",
    "applications": [
      "Snap button attaching on shirts, blouses, jeans, casual wear",
      "Continuous-production garment lines",
      "Operations where air-driven tools are preferred for safety and cleanliness"
    ],
    "industry": "Garment manufacturing, shirt production, casual wear, jeans finishing"
  },
  "overviewDescription": "Made by Jocky (China; brand distinct from Jockey apparel — the snap-machine brand is Jocky per jockymachines.com / jockytech.com). The JK-SQ1 is the base 1-puncher model in the JK-SQ series. JK-Q1 is a sibling model in the same series. Pneumatic drive allows operation without electricity as long as compressed-air pressure is maintained, which the manufacturer highlights as a safety and energy-efficiency advantage.",
  "classificationTable": [
    {
      "field": "Machine Name",
      "value": "1-Puncher Pneumatic Snap Attaching Machine with Protector Ring"
    },
    {
      "field": "Brand / Manufacturer",
      "value": "Jocky, China"
    },
    {
      "field": "Model Series",
      "value": "JK-SQ series (SQ1 = 1-puncher base, Q1 = related variant)"
    },
    {
      "field": "Stitch Type",
      "value": "N/A (mechanical snap-attaching, not a stitch machine)"
    },
    {
      "field": "Bed / Frame Type",
      "value": "Vertical press, single-puncher"
    },
    {
      "field": "Needle Configuration",
      "value": "N/A (uses male/female snap dies, not needles)"
    },
    {
      "field": "Drive / Lubrication",
      "value": "Pneumatic (compressed air)"
    }
  ],
  "technicalSpecs": [
    {
      "parameter": "Drive",
      "value": "Pneumatic (compressed air)"
    },
    {
      "parameter": "Number of Punches",
      "value": "1 (single die set per cycle)"
    },
    {
      "parameter": "Protector Ring",
      "value": "Integrated (per model name 'SQ1 with protector ring')"
    },
    {
      "parameter": "Max Attaching Rate (sibling JK-Q1)",
      "value": "2,500 sti/min (per Alibaba listing; not verified for JK-SQ1 specifically)"
    }
  ],
  "resources": [
    {
      "resourceName": "JockyTech — JK-SQ1 product page (Tier-1)",
      "description": "Tier-1 manufacturer product page",
      "url": "https://www.jockytech.com/jk-sq1-1-puncher-pneumatic-snap-attaching-machine-with-protector-ring-product"
    },
    {
      "resourceName": "JockyMachines — product catalog (Tier-1)",
      "description": "Manufacturer catalog listing JK-SQ1 and sibling JK-Q1",
      "url": "https://www.jockymachines.com/products"
    },
    {
      "resourceName": "Alibaba JOCKY JK-Q1 listing (Tier-2 sibling)",
      "description": "Pneumatic snap button machine with EU standards, sibling model",
      "url": "https://www.alibaba.com/product-detail/JOCKY-JK-Q1-One-Puncher-Pneumatic_60030671785.html"
    }
  ],
  "finalNotes": "Phase 1 basic research complete. Phase 1 PARTIAL PASS: max attaching rate (2,500 sti/min) is taken from the sibling JK-Q1 listing only — JK-SQ1 documentation does not list a published rate. Per skill rule §1.8, this limitation is recorded rather than presented as confirmed for the requested exact model. Detailed Research remains unfilled."
}
