{
  "title": "Juki LH-3568A-7",
  "subtitle": "2-Needle, Semi-Dry-Head, Lockstitch Machine with Automatic Thread Trimmer",
  "brand": "JUKI",
  "category": "Lockstitch Machine",
  "machineImage": "",
  "reportDownloadUrl": "",
  "publishedDate": "2026-07-22T00:00:00.000Z",
  "purposeAndApplication": {
    "purpose": "The Juki LH-3568A-7 is a 2-needle, semi-dry-head, lockstitch machine in the LH-3568A series. The split needle bar allows jeans and heavy-weight variants (-G) for denim work; standard (-S) for shirts, trousers, uniforms, light jackets.",
    "applications": [
      "2-needle decorative seams on shirts, trousers, uniforms, light jackets",
      "Medium-weight woven and knit assembly",
      "Split-bar decorative stitching where needle separation matters",
      "Jeans / heavy-weight variants for denim (LH-3568A-G)"
    ],
    "industry": "Garment manufacturing (woven + knit), shirt production, trouser production, denim work"
  },
  "overviewDescription": "Made by Juki (Japan). Series features include semi-dry head (reduced oil staining), direct-drive mechanism, organized split needle bar. Sub-models include F7WBAK135 (full-automatic with thread trimmer, backtack, wiper). Speed ceiling 3,000 sti/min across the series.",
  "classificationTable": [
    {
      "field": "Machine Name",
      "value": "2-Needle, Semi-Dry-Head, Lockstitch Machine"
    },
    {
      "field": "Brand / Manufacturer",
      "value": "JUKI, Japan"
    },
    {
      "field": "Model Series",
      "value": "LH-3568A (sub-variants: S = medium-weight standard, G = jeans/heavy; -7 = full-automatic with thread trimmer)"
    },
    {
      "field": "Stitch Type",
      "value": "Lockstitch (2-needle)"
    },
    {
      "field": "Bed / Frame Type",
      "value": "Flat bed"
    },
    {
      "field": "Needle Configuration",
      "value": "2-needle, split needle bar"
    },
    {
      "field": "Drive / Lubrication",
      "value": "Direct-drive, semi-dry head"
    }
  ],
  "technicalSpecs": [
    {
      "parameter": "Max. Sewing Speed",
      "value": "3,000 sti/min"
    },
    {
      "parameter": "Max. Stitch Length",
      "value": "5 mm"
    },
    {
      "parameter": "Application",
      "value": "S = medium-weight, G = jeans/heavy-weight"
    },
    {
      "parameter": "Presser Foot",
      "value": "Standard hook"
    }
  ],
  "resources": [
    {
      "resourceName": "Juki LH-3568A-7 product page (Tier-1)",
      "description": "Tier-1 manufacturer product page",
      "url": "https://juki.com/lh-3568a-7-lh-3568a"
    },
    {
      "resourceName": "Sew Solutions AE product page (Tier-2)",
      "description": "Authorized dealer product page",
      "url": "https://sewsolutions.ae/product/juki-lh-3568a-7-lh-3568a-2-needle-lockstitch-machine"
    },
    {
      "resourceName": "Sunny Sewing Center (Tier-2)",
      "description": "Authorized dealer product page confirming split-bar lockstitch with standard hook",
      "url": "https://sunnysewingcenter.com/index.php/product/juki-lh-3568a-double-needle-split-bar-lockstitch-sewing-machine-regular-hook"
    }
  ],
  "finalNotes": "Phase 1 basic research complete with Tier-1 manufacturer + 2 Tier-2 dealers (3 sources agree). Detailed Research remains unfilled — partial-data state; the page will display the 'More Information Coming Soon' banner until Detailed Research adds working principles, sequence flow, parts list, maintenance, and additional resources."
}
