{
  "title": "Ramsons RHW 30",
  "subtitle": "Horizontal Washing Machine (Side-Loading Stainless Steel, 30 kg)",
  "brand": "Ramsons",
  "category": "Other",
  "machineImage": "",
  "reportDownloadUrl": "",
  "publishedDate": "2026-07-23T00:00:00.000Z",
  "purposeAndApplication": {
    "purpose": "The RHW 30 is the 30 kg-capacity model in the same RHW horizontal washing machine range as the RHW 200 above (siblings: 15/30/50/75/100/150/200), sharing the same core design. Wet-processing (washing) of linen and garments at smaller (30 kg) batch capacity, with a raised door design for better liquor holding ratio and a stainless steel chemical dispenser.",
    "applications": [
      "Smaller-scale institutional / commercial laundry",
      "Garment wet-processing"
    ],
    "industry": "Garment / apparel finishing, commercial laundry"
  },
  "overviewDescription": "Made by Ramsons Garment Finishing Equipment Pvt. Ltd. (Bengaluru, Karnataka, India). Horizontal side-loading drum with hot-forged end flange shafts. Reduction pulley system or gearbox-and-pulley system.",
  "classificationTable": [
    {
      "field": "Machine Name",
      "value": "Horizontal Washing Machine"
    },
    {
      "field": "Brand / Manufacturer",
      "value": "Ramsons Garment Finishing Equipment Pvt. Ltd. (India)"
    },
    {
      "field": "Model Series",
      "value": "RHW — sibling capacities 15 / 30 / 50 / 75 / 100 / 150 / 200"
    },
    {
      "field": "Bed / Frame Type",
      "value": "Horizontal side-loading drum; hot-forged end flange shafts"
    },
    {
      "field": "Drive Type",
      "value": "Reduction pulley system or gearbox-and-pulley system"
    },
    {
      "field": "Heating",
      "value": "Not specified for this exact model (RHW 200 sibling: steam / electric / gas)"
    }
  ],
  "technicalSpecs": [
    {
      "parameter": "Load Capacity",
      "value": "30 kg"
    },
    {
      "parameter": "Basket Volume",
      "value": "440 ltrs (nameplate)"
    },
    {
      "parameter": "Drive Motor",
      "value": "2 HP (nameplate)"
    },
    {
      "parameter": "Electric Supply",
      "value": "415 V, 3-Phase, 50 Hz (nameplate)"
    },
    {
      "parameter": "Machine Dimensions (W×D×H)",
      "value": "1690 × 1310 × 1330 mm (nameplate)"
    },
    {
      "parameter": "Machine Weight",
      "value": "600 kg (nameplate)"
    },
    {
      "parameter": "Manufacturing Year (this unit)",
      "value": "2023"
    },
    {
      "parameter": "Serial Number (this unit)",
      "value": "RHW 30 23 01"
    }
  ],
  "resources": [
    {
      "resourceName": "Ramsons India official product page — RHW 30 (Tier-1)",
      "description": "Manufacturer product page (qualitative features only — no numeric spec table)",
      "url": "https://ramsons.addnetit.com/products/commercial-laundry/horizontal-washing-machines/rhw-30.php"
    },
    {
      "resourceName": "Machine spec plate (Tier-1, supplied by user)",
      "description": "User-supplied nameplate — basket volume, drive motor, electric supply, dimensions, weight, manufacturing year, serial number",
      "url": "n/a — nameplate photo in user archive"
    },
    {
      "resourceName": "IndiaMART — Ramsons Vertical Washing Machine and Vertostar category (Tier-2)",
      "description": "Independent reseller listing naming the RHW 30 Horizontal Washing Machine as a distinct SKU",
      "url": "https://www.indiamart.com/ramsonsgarmebengaluru/ramsons-vertical-washing-machine-and-vertostar.html"
    }
  ],
  "finalNotes": "• Phase 1 PARTIAL PASS — Model identity and headline capacity (30 kg) are confirmed directly on the manufacturer's own official product page and cross-confirmed by multiple independent dealer listings, AND the nameplate now supplies a full technical spec table (basket volume, motor, dimensions, weight) where none could be found on the web.\n• However, all dimensional/technical figures now rest on that single Tier-1 (nameplate) source with no independent second source to cross-check — so the verdict stays at PARTIAL PASS rather than moving up to clean PASS.\n• Detailed Research (working principles, sequence flow, parts list, maintenance, additional resources) remains pending — the page renders the 'More Information Coming Soon' banner until those sections are added."
}
