{
  "title": "Zoje ZJ5780BS",
  "subtitle": "Electronic Straight Buttonhole Sewing Machine",
  "brand": "ZOJE",
  "category": "Buttonhole Machine",
  "machineImage": "",
  "reportDownloadUrl": "",
  "publishedDate": "2026-07-22T00:00:00.000Z",
  "purposeAndApplication": {
    "purpose": "The ZJ5780BS is an electronically controlled straight buttonhole sewing machine with 30+ programmable buttonhole patterns. Designed for men's and women's garments with plain or bartacked buttonholes.",
    "applications": [
      "Straight buttonholes on shirts, blouses, jackets, trousers",
      "Bartacked buttonholes on heavy garments",
      "Programmable buttonhole length and bartack variations",
      "Eyelet buttonholes with optional attachment"
    ],
    "industry": "Garment manufacturing (shirts, blouses, jackets, work-wear, formal wear)"
  },
  "overviewDescription": "Made by Zoje (Zhejiang, China). Part of the ZJ5780 buttonhole family. Related models include ZJ-5780L (longer buttonhole range 9.4–120 mm), ZJ-5780AS (Asian-market variant), ZJ-5780S (Russian-market variant). The ZJ5780BS is the base straight-buttonhole configuration with 30 built-in patterns, programmable via the on-board control panel.",
  "classificationTable": [
    {
      "field": "Machine Name",
      "value": "Electronic Straight Buttonhole Machine"
    },
    {
      "field": "Brand / Manufacturer",
      "value": "ZOJE (Zhejiang Zoje Sewing Technology Co., Ltd., China)"
    },
    {
      "field": "Model Series",
      "value": "ZJ-5780 (variants: ZJ-5780BS base, ZJ-5780L long, ZJ-5780AS, ZJ-5780S)"
    },
    {
      "field": "Stitch Type",
      "value": "Buttonhole (straight, with electronic pattern control)"
    },
    {
      "field": "Bed / Frame Type",
      "value": "Flat bed (buttonhole-specific geometry)"
    },
    {
      "field": "Needle Configuration",
      "value": "Single needle (DP×5)"
    },
    {
      "field": "Drive / Lubrication",
      "value": "Direct-drive servo, semi-dry head, electronic control"
    }
  ],
  "technicalSpecs": [
    {
      "parameter": "Max. Sewing Speed",
      "value": "3,600 rpm (SPM)"
    },
    {
      "parameter": "Max. Buttonhole Length (BS base)",
      "value": "~41 mm (ZJ-5780L extended variant: 9.4–120 mm)"
    },
    {
      "parameter": "Max. Bartack Length",
      "value": "5 mm"
    },
    {
      "parameter": "Needle Type",
      "value": "DP×5"
    },
    {
      "parameter": "Power",
      "value": "220 V"
    },
    {
      "parameter": "Material",
      "value": "Textile (light to medium woven)"
    },
    {
      "parameter": "Patterns",
      "value": "30 built-in buttonhole patterns"
    },
    {
      "parameter": "Drive",
      "value": "Direct-drive"
    }
  ],
  "resources": [
    {
      "resourceName": "Zoje Europe — Buttonhole machines category (Tier-1)",
      "description": "Tier-1 manufacturer category page for straight buttonhole machines",
      "url": "https://www.zoje-europe.com/buttonhole-machines-straight/cat/k-2002502"
    },
    {
      "resourceName": "leg-prom.com.ua — ZJ-5780S spec sheet (Tier-2)",
      "description": "Russian-market distributor with full ZJ-5780S numeric specifications",
      "url": "https://leg-prom.com.ua/en/shvejnoe_oborudovanie/petelnie_mashini/zoje-zj-5780-s-elektronnyj-petelnyj-poluavtomat-s-integrirov"
    }
  ],
  "finalNotes": "Phase 1 basic research complete (PARTIAL PASS — buttonhole length varies by sub-variant: 41 mm base vs 120 mm long). Loop-back resolved by sub-variant classification. Detailed Research remains unfilled — partial-data state; the page will display the 'More Information Coming Soon' banner until Detailed Research adds working principles, sequence flow, parts list, maintenance, and additional resources."
}
