{
  "title": "Zoje ZJ2845-BD-D3-3/02",
  "subtitle": "2-Needle Direct-Drive Micro-Oil Lockstitch Machine",
  "brand": "ZOJE",
  "category": "Lockstitch Machine",
  "machineImage": "",
  "reportDownloadUrl": "",
  "publishedDate": "2026-07-22T00:00:00.000Z",
  "purposeAndApplication": {
    "purpose": "The ZJ2845-BD is a 2-needle lockstitch machine with a built-in direct-drive AC servo motor, designed for light-to-medium material sewing. The -BD-D3-3/02 suffix indicates direct-drive (-BD), micro-oil lubrication (-D3), and 3/02 variant.",
    "applications": [
      "Twin-needle decorative stitching on shirts, blouses, trousers",
      "Light-to-medium woven fabric assembly",
      "Production lines with auto thread trimmer and energy-saving servo motor"
    ],
    "industry": "Garment manufacturing, shirt production, light industrial textile assembly"
  },
  "overviewDescription": "Made by Zoje (Zhejiang, China). Part of the ZJ2845/2875 series of 2-needle lockstitch machines. The `-BD` suffix denotes direct-drive (built-in servo), D3 indicates micro-oil lubrication system. The ManualsLib listing of the operation manual (77 pages) is the canonical reference for this family.",
  "classificationTable": [
    {
      "field": "Machine Name",
      "value": "2-Needle Lockstitch Machine (Direct-Drive, Micro-Oil)"
    },
    {
      "field": "Brand / Manufacturer",
      "value": "ZOJE (Zhejiang Zoje Sewing Technology Co., Ltd., China)"
    },
    {
      "field": "Model Series",
      "value": "ZJ2845 (variants: ZJ2842, ZJ2845, ZJ2872, ZJ2875; -BD = direct-drive; -D3 = micro-oil)"
    },
    {
      "field": "Stitch Type",
      "value": "Lockstitch (twin needle)"
    },
    {
      "field": "Bed / Frame Type",
      "value": "Flat bed"
    },
    {
      "field": "Needle Configuration",
      "value": "2-needle, fixed needle gauge (5 mm standard, 7 mm optional)"
    },
    {
      "field": "Drive / Lubrication",
      "value": "Direct-drive (built-in AC servo motor), micro-oil"
    }
  ],
  "technicalSpecs": [
    {
      "parameter": "Max. Sewing Speed",
      "value": "3,000 s.p.m."
    },
    {
      "parameter": "Max. Stitch Length",
      "value": "5.0 mm"
    },
    {
      "parameter": "Presser Foot Lift Height",
      "value": "11 mm"
    },
    {
      "parameter": "Needle System",
      "value": "135×5 (DP×5)"
    },
    {
      "parameter": "Built-in AC Servo Motor",
      "value": "yes"
    },
    {
      "parameter": "Thread Trimmer",
      "value": "automatic (-D3 sub-variant)"
    }
  ],
  "resources": [
    {
      "resourceName": "Zoje Europe — ZJ2845 split-needles category page (Tier-1)",
      "description": "Tier-1 European distributor page",
      "url": "https://www.zoje-europe.com/2-needle-flat-bed-lockstitch-machines-with-split-needles/cat/k-2002488"
    },
    {
      "resourceName": "Zoje America — ZJ2845/2875 series (Tier-1)",
      "description": "Tier-1 manufacturer technical detail page",
      "url": "http://zoje-america.com/direct-drive-high-speed-double-needles-lockstitch-zj28452875-series"
    },
    {
      "resourceName": "Zoje ZJ2845-BD operation manual (ManualsLib) (Tier-3)",
      "description": "77-page operation manual for the BD variant",
      "url": "https://www.manualslib.com/products/Zoje-Zj2845-Bd-10894670.html"
    }
  ],
  "finalNotes": "Phase 1 basic research complete with Tier-1 Zoje Europe + Zoje America. Loop-back resolved a needle-gauge conflict (5 mm canonical per zoje.com spec table vs 6.4 mm per zoje-europe market reference) — resolved to 5 mm standard with the 6.4 mm noted as regional European market variant. Detailed Research remains unfilled — partial-data state; the page will display the 'More Information Coming Soon' banner until Detailed Research adds working principles, sequence flow, parts list, maintenance, and additional resources."
}
